contextText,location_fromMOH,searchCriteria_bigram,searchCriteria_type,source_bNumber,source_fileName,time_year
"(b) On Retirement—That men and women who can give effective service should be given the opportunity, without regard to age, to continue at work if they wish. Unemployment among women is mainly comprised of clerical and shop workers for whom there is difficulty in placing on account of age restrictions, and of women who require work for a limited number of hours owing to domestic responsibilities, many of whom only register for short periods when the urge or necessity to take a job arises. The rise in the number of women registered as unemployed in October was mainly due to married women registering for employment following the return of children to school and not to any other cause. Of the 44 registered as unemployed on 6th December. 22 were over 40 and 22 under that age. Also 20 of the women registered were married. There have been no important changes in local industry during the year excepting that at Bromley Gas Works where production of gas ceased on 31st March. All displaced workers were either transferred to other depots of the S.E. Gas Board or were placed in other employment by this office. 18 Although unemployment has remained so low",Bromley,"married,women",bigram search,b19821633,Bromley.1954.b19821633.txt,1954
"for Children under Five As an adjunct to the scheme for dealing with behaviour problems it is further proposed to set up at Park Lane Clinic and Day Nursery during 1955 an experimental ""play group"" where children with such problems can mix and play with other children. The scheme envisages the co operation of the Child Guidance staff and it is hoped to report progress at an early date. Daily Guardian Scheme The supervised daily minding of children under school age, whose mothers are in full-time enployment was established in this Area in 1947, It commenced very modestly with three married women who were prepared to take into their own homes, children whose mothers could not make any other satisfactory arrangements for minding by the day. Each guardian is paid one shilling a day for each child placed with her, irrespective of payment received from the mother. There are no retaining fees and payment commences after registration and evidence of the receipt of the child. No guardian may accept more than two children. The selection of guardians is limited to those who are prepared to keep to the rules of the scheme and are approved by the health visitor for",Tottenham,"married,women",bigram search,b19881915,Tottenham.1954.b19881915.txt,1954
"0-085 for atmospheric solid deposit and + 0.262 for atmospheric sulphur dioxide concentration. The first three are significant and the last two are not. The highest correlation is that with the percentage in social classes IV and V, and it is therefore not surprising to find some degree of correlation with overcrowding and lack of open space which are frequently associated inversely with social class. This finding of an association between lung cancer and social class is in keeping with Logan's (1954) description of the social class gradient in lung cancer. He noted that the gradient was not found in married women or in men over the age of 65 years. The correlation between lung cancer and atmospheric pollution was not significant in this analysis, but this in itself does not preclude an association between them. 145 K1 Lung cancer death-rate—Overcrowding, social class, open space and atmospheric pollution Lung cancer D.R. per 1,000 aged 75+ 1950-4 (Average) Percentage of persons living at a density of more than 2 per room 1951 Percentage of social classes IV & V 1951 Existing open space per 1,000 persons (Acres) 1951 Atmospheric pollution Solid deposit to 1954 Sulphur dioxide concentration (b) 1954 Division 1",LondonCountyCouncil,"married,women",bigram search,b18252989,LondonCountyCouncil.1954.b18252989.txt,1954
"Group for Children under Five As an adjunct to the scheme for dealing with behaviour problems it is further proposed to set up at Park Lane Clinic and Day Nursery during 1955 an experimental ""play group"" where children with such problems can mix and play with other children. The scheme envisages the co-operation of the Child Guidance staff and it is hoped to report progress at an early date. Daily Guardian Scheme The supervised daily minding of children under school age, whose mothers are in full-time employment was established in this Area in 1947. It commenced very modestly with three married women who were prepared to take into their own homes, children whose mothers could not make any other satisfactory arrangements for minding by the day. Each guardian is paid one shilling a day for each child placed with her, irrespective of payment received from the mother. There are no retaining fees and payment commences after registration and evidence of the receipt of the child. No guardian may accept more than two 72 children. The selection of guardians is limited to those who are prepared to keep to the rules of the scheme and are approved by the health visitor",Hornsey,"married,women",bigram search,b18249395,Hornsey.1954.b18249395.txt,1954
"much evidence to show they are also happier and healthier if allowed to do so. Page 36 One of the objections raised to the employment of people beyond the present retiring ages is the alleged increased incidence of sickness amongst older members of the staff. In this connection a recent report on sickness in a health department of a local authority (published in the ""Monthly Bulletin of the Ministry of Health and the Public Health Laboratory Service"" for October, 1954), is of the greatest interest. It was found that in general women lost more time through illness than men and married women lost more time than a single woman. For each category, however, the sickness rates rose to a maximum for staff between the ages of 50 and 55, and decreased markedly thereafter. Both single and married women over 60 lost less working days per year than those in any other age group and men over 60 lost almost as little time as the youngest. Specimen figures are given in the following table:— WORKING DAYS LOST PER YEAR Ages Men Single women Married women 30 years+ 4 8 28 40 years+ 7 15 21 50 years+ 13 21 29 60",Barking,"married,women",bigram search,b19784442,Barking.1954.b19784442.txt,1954
"This areal comparability factor is based on the ratio of the proportion of the number of women aged 18-44 years in the local population to the national proportion and hence allows for the varying proportion of women of child bearing age but not for any other factor. For London this factor, which was 0.91 in 1949, has been 0.87 for the past three years and the crude birth rate multiplied thereby becomes 13.1 instead of 15.1 per 1,000 population as compared with the national figure of 15.0. This adjusted figure does not take into account, however, the differing proportions of married women in the two populations under consideration—the proportion of women married aged 15 to 44 in London was only 95 per cent. of the corresponding proportion for England and Wales at the census in 1951. Assuming no radical change in the pattern of marriage the 13 per cent, difference between the adjusted birth rate for London and the national figure can be accounted for as to 5 per cent, by the proportionately fewer married women in London and as to 8 per cent, by a real difference in the fertility of London marriages. The crude birth rate for the",LondonCountyCouncil,"married,women",bigram search,b18252990,LondonCountyCouncil.1955.b18252990.txt,1955
"were admitted for varying periods of time. At the end of the year the number in the Home was:— Six mothers and 6 babies, 2 shelter cases and 3 ante-natal cases. Total—11 girls and 6 babies."" Report of Sister Papps, Outdoor Worker:— ""Two hundred and three cases have been referred and dealt with and there were 47 cases in hand at the end of the year. Of the new cases. 80 were maternity, 81 were preventive cases concerning young people. 19 were matrimonial, 2 were rescue cases, and 21 miscellaneous. Of the maternity cases, 65 were single girls, 9 were married women having illegitimate children, 5 were divorcees and 1 was a widow. Ninety-one of the above cases were from Bromley and district. During the year 601 home visits have been paid, 1,437 interviews given and 28 meetings addressed."" 33 HOSPITAL SERVICES. The following hospitals are within the area, and under the control of the Bromley Group Hospital Management Committee, whose offices are at Farnborough Hospital. Farnborough. Kent. (a) Bromley Hospital, Cromwell Avenue. General hospital with 133 beds. Bromley Hospital Maternity Units: 20. Masons Hill. Bromley. Provision for 34 beds. 118. Widmore Road. Bromley. Provision for 20 beds. Chest Clinic.",Bromley,"married,women",bigram search,b19821645,Bromley.1955.b19821645.txt,1955
"residing within the County; the corresponding excess in 1955 was 7,500. The birth-rate in London tends to follow the same trend as for the country as a whole—indeed, since 1947 the crude rates have been practically identical. The two rates are not however strictly comparable because the proportion of women of child-bearing age in the population is greater in London than in England and Wales; adjusting for this difference by multiplying the crude rate by the Registrar-General's areal comparability factor for London births (0.88) the rate becomes 14.0. This factor makes no allowance however for the differing numerical proportions of married women in London compared with England and Wales—at the 1951 census the proportion of London women married at these ages was 95 per cent. 8 of the corresponding proportion for England and Wales. The crude birth rate for the past 21 years is shown in the diagram (page 10) together with the national rate and, since 1949, the adjusted birth rate : the true comparative fertility of London lies somewhere between the lines for the crude rate and the adjusted rate. The actual numbers and rates are given, together with those for still-births, in Table 2 (page 230). For",LondonCountyCouncil,"married,women",bigram search,b18253003,LondonCountyCouncil.1956.b18253003.txt,1956
"female, 65 male) 84 (47 male, 37 female Disabled Persons (on disabled register 49 (38 male, 1) female 45 Women A high number of women were employed in the various industries and generally gave a good account of themselves, as compared with men. However, it was agreed that despite good service that on the whole there was always the greater liability to absenteeism in the case of women. This occurred not so much through personal illness as through illness in other members of the family or other purely domestic reasons, e.g. being at home to let the sweep in. Naturally, married women were susceptible to such considerations to a greater degree than the unmarried. Young Persons Young persons were found to be generally scattered through the various trades and there was not sufficient grouping of them in particular occupations to call for any special comments. Accidents among young persons were very low but it was found that where 1 arge numbers of young persons were employed together, accident rates went up this being due to 1ack of experience and ""sky larking"" attitude of many of them. It seems that young persons scattered in with more experienced workers are given a",Tottenham,"married,women",bigram search,b19881939,Tottenham.1956.b19881939.txt,1956
"the Centre for routine treatments, but owing to the cost of transport this is largely limited to the Canning Town area. Loan Scheme. The scheme for the loan of nursing equipment has been increasingly used and has proved of great assistance in improving the care of sick persons nursed in their own homes. Future of the Service. There has been no improvement in the recruitment of trained staff for full-time employment. The part-time staff are the mainstay of the service and we have been fortunate in retaining many of the present staff for over 5 years. Most of these are married women and some of them (who have older children) are now able to work additional hours. This has been a considerable help to the service and enabled all requests for nursing care to be met. Any extension to cover a later evening service, although desirable, cannot be contemplated until an appreciable increase in full-time staff is achieved. This continued shortage of whole-time nursing staff is a serious national firoblem. The limited number of staff who qualify each year tend to remain in the hospital service. The very nature of the home nursing duties in districts such as West Ham,",WestHam,"married,women",bigram search,b19881605,WestHam.1956.b19881605.txt,1956
"whose responsibility it is to make the day to day arrangements. During 1956, on the average the equivalent of 40 whole time Home Helps were employed in the Division; this at times necessitates the engagement of as many as 63 part or whole time Helps. A total of 903 cases were assisted, (i.e. 236 maternity, 23 tuberculosis, 281 chronic sick, aged or infirm and 363 acute cases) this being easily the highest number dealt with to date. Family Planning. Since 1945 a Family Planning Clinic has been provided for this District and it is now held at Westway, Caterham-on-the-Hill. Only married women whose health would be adversely affected if 34 advice were with-held can be seen and applications for appointments should be made to the Divisional Medical Officer at 115 Brighton Road, Purley. During 1956 only 93 persons were seen from the whole of the Division, the total attendance being 191. Health Visitation. The equivalent of about 8 whole time Health Visitors are employed in this District, and they visit in their homes the vast majority of ante-natal and nursing mothers and their children until these are of school age. They also are the School Health Visitors and attend most",Coulsdon,"married,women",bigram search,b19786207,Coulsdon.1956.b19786207.txt,1956
"London followed closely that for England and Wales until 1956 when the rise in the London rate preceded a similar rise in the country as a whole, but in 1957 the two rates are again almost identical. The two rates are not however strictly comparable because the proportion of women of child-bearing age in the population is greater in London than in England and Wales; adjusting for this difference by multiplying the crude rate by the Registrar General's areal comparability factor for London births (0.89) the rate becomes 14.4. This factor makes no allowance for the differing numerical proportions of married women in London compared with England and Wales—at the 1951 census the proportion of London women married at these ages was 95 per cent, of the corresponding proportion for England and Wales. The crude birth rate for the past 21 years is shown in the diagram (page 6) together with the national rate and, since 1949, the adjusted birth rate: the true comparative fertility of London lies somewhere between the lines for the crude rate and adjusted rate. Figure 1 LIVE BIRTH RATELONDON (A.C.) AND ENGLAND & WALES 1937-57 *Rates based on total population 1937-1949, home population 1950- Still—births",LondonCountyCouncil,"married,women",bigram search,b18253015,LondonCountyCouncil.1957.b18253015.txt,1957
"21 With the ready co-operation of three factory managements, programmes consisting of a talk on food hygiene and the showing of the instructional colour film ""Food without Fear"" were arranged. Food handlers from other factory canteens nearby were invited to these three meetings and a total of 162 people attended. Each programme took the form of a short introductory talk followed by the film, after which questions were invited. A great amount of effort was expended in encouraging people to attend, but it is difficult to assess the ultimate value of this form of education. Many factory canteen workers are married women with family responsibilities and are unable or unwilling to attend in their own time, whilst Managements are often unable or reluctant to release their personnel during working hours. Samples of washing-up waters and swabs from kitchen utensils and equipment were taken from 68 premises, including restaurants, cafes, school kitchens and sculleries, factory canteens, hotel kitchens, public houses and shops. Altogether 69 samples of washing-up water and 150 swabs from utensils and equipment were examined. In 45 cases results on examination were considered to be unsatisfactory. Advice on washing up technique was given where indicated as necessary by the",Enfield,"married,women",bigram search,b19789464,Enfield.1957.b19789464.txt,1957
"early April to early December of previous year. An increase to 250 per cent of this average or an increase of 30 per cent over the previous week indicates an epidemic which is almost always due to influenza. Notifications were received from the local office of the Ministry of Pensions and National Insurance on the 7th January and on the 25th September. The figures relate only to the working population eligible for sickness benefit and excludes such important sections as the aged who have retired and are drawing retirement pensions, school children and pre-school children and the considerable number of married women who have decided not to pay contributions. 16 SECTION B. HEALTH AND SOCIAL SERVICES In this section are included hospitals and clinics serving the Borough but not all of which are situated within the Borough. Many of these services including the provision and supervision of old persons homes within the Borough are directly administered by the County, and the District Officer and District Organiser of the Home Help Service have contributed information for which I am grateful. I am indebted to Mr. Forster and to Mrs. Fisher for their accounts of the work of the T.B. Care Committee",Beckenham,"married,women",bigram search,b1978501x,Beckenham.1957.b1978501x.txt,1957
"1,356 2,501 41,813 51,052 92,865 Grand Total: 3,101 2,501 92,865 These tables do not show any striking difference from those for 1956. Home Nursing Centre The service for patients residing north of the District Railway line was provided, as previously, by the staff from the Lady Rayleigh Training Home (under agency arrangements with the Essex County Council). South of the Railway line the service continued from the Liverpool Road Centre. Prom there the nurses go out to cover the whole of this area. Those patients who were able attended the Centre and were treated there. The service mostly depends on married women who can only spare a few hours a day from their home commitments, but who also have a real sense of vocation for nursing and enjoy their work. This has resulted in them voluntarily undertaking to maintain a latenight service where the need arises. Loan Scheme The provision on loan of nursing equipment for patients nursed at home continues to be a valuable adjunct to the Home Nursing Service. Laundry Service Plans for this service have continued to develop slowly and it is hoped that it will commence early in the new year. Queens Institute of District Nursing",WestHam,"married,women",bigram search,b19881617,WestHam.1957.b19881617.txt,1957
"as 63 part or whole time Helps. A total of 1,032 cases were assisted, (i.e. 301 maternity, 17 tuberculous, 398 chronic sick, aged or infirm and 316 acute cases) this being easily the highest number dealt with 34 to date due to increases in the number of maternity and chronic sick cases. A recent development has been the training and employment of specially selected ""teaching Home Helps"" for use in suitable cases, who are mainly ""Problem Families"". Family Planning. Since 1945 a Family Planning Clinic has been provided for this District and it is now held at Westway, Caterham-on-the-Hill. Only married women whose health would be adversely affected if advice were withheld can be seen and applications for appointments should be made to the Divisional Medical Officer at 115 Brighton Road, Purley. During 1957 only 119 persons including 50 new cases were seen from the whole of the Division, the total attendance being 225. Health Visitation. The equivalent of about 8 whole time Health Visitors are employed in this District, and they visit in their homes the vast majority of ante-natal and nursing mothers and their children until these are of school age. They also are the School Health Visitors",Coulsdon,"married,women",bigram search,b19786219,Coulsdon.1957.b19786219.txt,1957
"West Ham area, has an office in Ilford, but may be consulted at St. Agatha's Hostel, Carnarvon Road, on Tuesdays from 4.30 p.m. Any unmarried mother may be referred to Miss Treacher for help and counselling. There is free exchange of information and excellent co-operation between Miss Treacher and the local health authority offices, channelled mainly through the Superintendent Health Visitor. 43 Miss Treacher reports that during 1958 her help was sought for 51 illegitimate children and their parents resident in West Ham, There were, in addition, two families for whom help was sought for other reasons. Seven cases concerned married women having illegitimate babies; the remainder were single women. Twenty-one were admitted to Mother and Baby Homes, and in l8 of these, application was made to the local health authority for financial assistance. Altogether, the department was involved in the making of arrangements for the accommodation of 19 West Ham mothers. Nine were admitted to St. Agatha's Home during pregnancy and returned to the home after having the baby in hospital. Two were admitted to a home or hostel outside the Borough. When circumstances made it necessary, financial assistance was granted forwards the cost of maintenance. The problems which",WestHam,"married,women",bigram search,b19881629,WestHam.1958.b19881629.txt,1958
"44 45 Post-natal: Number of women attending during the year 5,839 4,258 4,543 3,887 3,714 Child welfare clinics: Number at end of year 165 176 178 178 179 Sessions per month 1,784 1,939 1,953 1,990 1,991 Attendances under a year: First 48,489 43,068 44,910 46,387 49,229 Total 683,089 587,143 595,690 613,147 611,057 Attendances over 1 year 282,202 193,273 189,388 183,538 177,283 Attendances at special toddlers clinics 35,500 41,268 41,055 40,848 38,940 Percentage of infants attending a centre at least once in the first year of life 86 86 86 86 88 Family planning Advice on family planning is provided for married women for whom further pregnancy would be detrimental to health. The number of women attending for advice was : 1957 1958 At sessions provided by Council .. .. 4,092 4,392 Referred by Council to Family Planning Association .. .. .. .. .. .. 688 702 National welfare foods Average weekly issues 1956 1957 1958 National dried milk (tins) 25,413 19,839 15,791 Cod-liver oil (bottles) 6,156 5,191 3,620 Vitamin tablets (packets) 2,952 2,788 2,736 Orange juice (bottles) 48,163 48,925 31,360 63 Day accommodation for children Table (ii)—Day nurseries and child minders At 31st December 1949 1955 1956 1957 1958 DAY",LondonCountyCouncil,"married,women",bigram search,b18253027,LondonCountyCouncil.1958.b18253027.txt,1958
"on Tuesdays from 4.30 p.m. Any unmarried mother may be referred to Miss Treacher for help and counselling. There is free exchange of information and excellent co-operation between Miss Treacher, and the local health authority officers, channelled mainly through the Superintendent Health Visitor. Much work with unmarried mothers who do not need special arrangements comes within the scope of the health visitor. Miss Treacher reports that during 1959 her help was sought for 55 illegitimate children and their parents resident in West Ham. There were, in addition, two families for whom help was sought for other reasons. Five cases concerned married women having illegitimate babies; the remainder were single women. Twenty-one were admitted to Mother and Baby Homes, and in 12 of these, application was made to the local health authority for financial assistance. Altogether, the department was involved in the making of arrangements for the accommodation of 24 West Ham mothers. Six were admitted to St. Agatha's Home during pregnancy, and returned to the home after having the baby in hospital. Eighteen were admitted to homes or hostels outside the Borough. When circumstances made it neoessary, financial assistance was granted towards the cost of maintenance. Six of the girls",WestHam,"married,women",bigram search,b19881630,WestHam.1959.b19881630.txt,1959
