contextText,location_fromMOH,searchCriteria_bigram,searchCriteria_type,source_bNumber,source_fileName,time_year
"Norland 558 24.6 Pembridge 319 17.0 Holland 219 10.9 Earl's Court 204 11.5 Queen's Gate 126 9.0 Redcliffe 216 11.7 Brompton 142 10.2 Tbe Borough 3,223 18.7 The effects of social status on the birth-rate are illustrated by the fact that the rate for South Kensington is less than half the rate for North Kensington, whilst the birth-rate for Golborne Ward in the North is more than three times as great as the rate for the Ward of Queen's Gate in the South. To a certain extent this wide discrepancy is no doubt due to differences in the numbers of married women in the districts compared. The births occurring every year in Kensington have fallen in round numbers from 4,500 in 1880, to 3,200 in the present year. The steady decline in the birth-rate is shown in Table VIII. Appendix, p. 91, where the number of births and the birth-rates both for London and Kensington are given for each quinquennial period since 1856. The figures for each year were given in the Annual Report for 1908. Illegitimate Births.—The illegitimate births numbered 172, and were equivalent to a rate of 10 per 10,000 persons living as compared with a rate of",KensingtonMetropolitanBorough,"married,women",bigram search,b18235670,KensingtonMetropolitanBorough.1911.b18235670.txt,1911
"Marylebone (0.16) being the lowest. Last year's rates were generally higher than the average, that for the Borough being, however, only 0.0l in excess. The districts in which last year's rates were below the averages were Kensington and St. Marylebone. Of the seven attacks reported last year, three occurred in primiparie, all unmarried women, two of them being unattended in their labour. Two of the children born to those women were dead at birth, and the third required instrumental assistance (there was some laceration). There was a history suggestive of gonorrhceal infection in one case at least. Of the four married women two had normal labours, a third was delivered with the help of instruments (some laceration), and the fourth was delivered of a dead child, she having chloroform and (presumably) surgical help in labour. One woman was attended by a qualified midwife and the others by medical men assisted (in two instances) by untrained women. Three of the married women died, none of the unmarried. The fatality among the reported cases was, therefore, 42 8 per cent., according to the Department's figures. The Registrar-General placed only two deaths under this heading, giving a fatality of 28-5 per cent. (See",PaddingtonMetropolitanBorough,"married,women",bigram search,b18245250,PaddingtonMetropolitanBorough.1911.b18245250.txt,1911
"129 135 104 110 108 Pall Mall 18 12 21 9 10 Great Marlborough 132 124 125 83 60 Charing Cross 34 31 24 16 22 Covent Garden 135 122 131 117 94 Strand 15 28 9 12 5 The City 2,927 2,913 2,751 2,592 2,361 A comparison of the corrected and uncorrected birth-rates, and of the death-rates of infants under one year of age, is made in the tables following this part of the Report. It will be noted that, the total number of births is again less than in previous years. The birth-rate calculated on the number of married women in Westminster, distinguishing the legitimate and illegitimate, shows more exact rates, but the new figures for making the calculation are not yet available. The reduction is taking place in the legitimate births. Westminster. 1904. 1905. 1906. 1907. 1908. 1909. 1910. 1911. Legitimate Births (net) 2,920 2,971 2,744 2,764 2,739 2,548 2,399 2,195 Illegitimate Births (net) 134 149 187 163 174 203 193 166 During the year notification was received of 1,562 births which took place in Westminster; of these, 55 were stillborn children, whose births are not subsequently registered. By comparing all the births which were registered as",CityofWestminster,"married,women",bigram search,b18247763,CityofWestminster.1911.b18247763.txt,1911
"to be derived from the facts just stated, is that it is a fallacy to calculate birth-rates on the gross population of the community, instead of on the number of women who, living at the child-bearing ages, are alone capablc of producing children. Nor must it be forgotten when considering the statistics relating to births that women are not now married so early in life as formerly, and that marriages before twenty-one are not nearly so numerous as they were twenty years ago; therefore, the fall in the birth-rate is undoubtedly partly due to the more limited time in which married women can bear their offspring. How much these later marriages of women have effected the birth-rate it is impossible to state with accuracy, for the particulars as to the age of persons marrying are no longer tabulated in the reports of the Registrar-General, which is to be regretted. The Medical Officer of Health in his annual report for 1904 discussed this question at length, when the conclusions he arrived at differed from those to which he has now given expression. The data were then altogether different, and, therefore, the inferences to be deduced from them were also different. A",IslingtonMetropolitanBorough,"married,women",bigram search,b18248500,IslingtonMetropolitanBorough.1911.b18248500.txt,1911
"about £9, and the cost of the Street shelter £4. These shelters were at first lent free, but it has been found more satisfactory to charge a small rent, varying from 1s. 6d. to 3d. a week, according to means. Only those who have no source of income are now exempted from payment. The weekly call to collect the rent insures that the shelter is being used. Shelters were lent to 16 persons last year, all being men. Five of these had the shelter free, one paid 1s. 6d., and the remainder 6d. a week. Two have been occupied by married women for over eighteen months. The results have been eminently satisfactory. There is no doubt that several lives have been prolonged, including lives of wage-earners and mothers, which are so valuable to their children. In many cases, too, the shelters have been of the greatest value in enabling an advanced and infectious case to be isolated from other members of the family; without the shelter the patient would have had to occupy the same bedroom, if not the same bed, as other persons. Three bedsteads with bedding are also lent to needy cases too poor to provide such. 84a.",Woolwich,"married,women",bigram search,b1982337x,Woolwich.1912.b1982337x.txt,1912
"Cauderlier (Les Lois de la Population, p. 188) carries with it conviction as to the large importance, in its effect upon the birth-rate of such migration. France is, it is affirmed, the country in which this ""migration interieure"" is most active. In departments such as Lozere, les Landes, la Haute Saone, l'Ariege, it is, allowing for the size of the populations concerned, more than double the amount of the emigration from Germany or England. M. Cauderlier (loc. cit. p. 188) argues that ""migration interieure"" operates as follows The birth-rate is higher in the towns because of the excessive proportions of married women of the reproductive ages (there were 158,000 married women per million inhabitants, from 15 to 50 years of age in the department of the Seine as against 139,000 in France as a whole). Fecundity, however, is lower in the towns (Seine 116, France 146, Basses Alpes 214, per 1,000 married women). The excessive proportion of married women in the towns, he says, is due to the fact that immigrants are in the main single persons eligible for marriage, or people recently married. Thus persons of reproductive ages are leaving a centre of high for one of low fecundity.",LondonCountyCouncil,"married,women",bigram search,b18252618,LondonCountyCouncil.1912.b18252618.txt,1912
"Norland 577 27 Pembridge 351 19 Holland 266 13 Earl's Court 200 11 Queen's Gate 128 9 Redcliffe 229 12 Brompton 132 10 The Borough 3,318 19 The effects of social status on the birth-rate are illustrated by the fact that the rate for South Kensington is less than half the rate for North Kensington, whilst the birth-rate for Golborne Ward in the North is more than three times as great as the rate for the Ward of Queen's Gate in the South. To a certain extent this wide discrepancy is no doubt due to differences in the numbers of married women of child-bearing age in the districts compared. The births occurring every year in Kensington have fallen in round numbers from 4,500 in 1380, to 3,300 in the present year The steady decline in the birth-rate is shown in Table V. Appendix, p. 79, where the number of births and the birth-rates both for London and Kensington are given for each quinquennial period since 1881. The figures for each year were given in the Annual Report for 1908. The fact that the total number of births has risen by 128, from 3,190 in 1910 to 3,318 in the present",KensingtonMetropolitanBorough,"married,women",bigram search,b18235682,KensingtonMetropolitanBorough.1912.b18235682.txt,1912
"corrected and uncorrected birth-rates, and of the death-rates of infants under one year of age, is made in the tables following this part of the Report. In the following wards: St. John, Hamlet, Conduit, St. Anne, Pall Mall, Great Marlborough and Covent Garden, there was an increase in the number of births. This, however, is counterbalanced by a decrease in all the other wards except Charing Cross, which was the same as in 1911. Fiom the figures given below it will be seen that the decrease in 1912 is in the illegitimate birth. The birth-rate calculated on the number of married women in Westminster, distinguishing the legitimate and illegitimate, shows more 6 exact rates, but the new figures for making the calculation are not yet available:— Westminster. 1905. 1906. 1907. 1908. 1909. 1910. 1911. 1912. Legitimate Births (net) 2,971 2,744 2,764 2,739 2,548 2,399 2,195 2,194 Illegitimate Births (net) 149 187 163 174 203 193 166 155 During the year notification was received of 1,469 births which took place in Westminster; of these, 34 were stillborn children, whose births are not subsequently registered. By comparing the births which were registered as having occurred after the 1st January with those notified,",CityofWestminster,"married,women",bigram search,b18247775,CityofWestminster.1912.b18247775.txt,1912
"the Borough notified to be suffering from consumption was 158. Enquiries made showed that 62 of these children have been exposed to infection at home. In the cases of 50 of these children there was a history of tuberculosis in a relative of the patient. Seven children died from consumption during the year. Two deaths were of children under two years of age. In two cases the children developed consumption after an attack of whooping-cough. 51 The number of women known to be suffering from consumption in the Borough at the end of 1912 was 204. Of these 128 were married women and 76 unmarried. There were 71 deaths of women patients during the year (54 married, 17 unmarried). In 102 cases the isolation of the patient was inadequate owing, in the majority of cases, to the straitened circumstances of the patient. This was also an unsatisfactory feature of the investigations made amongst the children patients visited. At the first visit 60 of the 158 children were found to be sleeping in the same bed with their parents or with other children. In most cases it was possible for the inspector to make some more or less satisfactory arrangements for",Battersea,"married,women",bigram search,b18111191,Battersea.1912.b18111191.txt,1912
"to child life. (4) The number of still births. (5) The quality of the help given at birth. Want of skilled care at birth may bear an important part in the number of deaths from accidents of child-birth. (6) The age of the mother. Excessive infant mortality is often ascribable in part to too early motherhood, with its associated inexperience and possible carelessness. (7) Poverty and social condition. Infant mortality is higher among the poor and lowest among the well-to-do. 64 (8) The non-domestic employment of married women. The infantile mortality is greatest in districts having the highest proportion of married women industrially employed. Such employment must necessarily involve some neglect of the home, and especially of any young children. (9) Poverty is a direct cause of infant mortality where it induces malnutrition of mother or infant, or where it implies that the mother cannot give adequate care to the infant. (10) Poverty is also an important indirect cause of infant mortality. Its influence is exercised in the following among other ways:— (a) Poverty is not infrequently associated with ignorance and carelessness. (b) With these are commonly associated overcrowding and uncleanliness. (c) Alcoholic habits frequently result from living under conditions",Stepney,"married,women",bigram search,b19822765,Stepney.1913.b19822765.txt,1913
"79 Report of the County Medical Officer—General. Fees charged by midwives. The fee a midwife receives for attending a confinement and for the subsequent 10 days' visiting varies in different localities from 5s. per case upwards, but usually a fee of 7s. 6d. to 10s. is expected. The charities employing midwives pay 5s. or 6s. a case, and provide the midwife with registers, forms, antiseptics, etc. It is apparent from the number of cases taken by midwives and the small fees paid that very few can rely solely on their practice as a means of livelihood. Many of them are married women who do not trouble to obtain a large practice; a few keep lying-in homes ; others, especially those with a fairly large practice, are approved by the Central Midwives Board to give practical instruction to pupils preparing for the Board's examination. The pupil resides with the midwife and goes with her to cases. The fees for pupils are usually about £1 1s. per week, which includes board and lodging in addition to the practical instruction given bv the midwife. Maternity charities. Many midwives are employed in Poor Law Infirmaries, and a large proportion of the 3,000 confinements in",LondonCountyCouncil,"married,women",bigram search,b1825262x,LondonCountyCouncil.1913.b1825262x.txt,1913
"of the married men works out at 38.5 years, i.e., men in the prime of life bringing up a family of young children. This will give some idea of the importance of doing everything to secure the return of these individuals to such a condition of health as will enable them to provide for their families until such time as they are self-supporting. It will be noticed that there is a difference of 12.5 years in the average age of the single men as compared with the married, and of 14.2 years in the single women as compared with the married women in the incidence of the disease. 22 The notifications occurred in the houses of the following rentals:— 16 or 15.38 per cent. were in houses of less than £20 per annum. 28 or 26 9 per cent. were in houses of from £20 to £26 per annum. 48 or 46 per cent. were in houses from £26 to £40 per annum. 8 or 7.69 per cent. were in houses from £40 to £60 per annum. 4 or 3.85 ner cent were in houses over £60 per annum. The following list gives the occupations of the cases of consumption",Wimbledon,"married,women",bigram search,b19971370,Wimbledon.1913.b19971370.txt,1913
"Urban District of Acton. . Annual Report . OF THE Medical Officer of Health TOGETHER WITH THE REPORT ON THE Medical Inspection of Schools, for the Year 1913. BS XI/18 ACT 20 Urban District of Acton, . Annual Report . OF THE Medical Officer of Health . . for the Year . . 1913. INDEX. Page. Anterior Poliomyelitis 32 Baby Show 62 Birth Rate 10 ,, ,, District 10 ,, ,, Illegitimate 13 ,, ,, Ward 11 Cancer 73 Census Statistics „ Age incidence of population 17 ,, ,, Buildings 7 ,, ,, Population 7 ,, ,, Street population in South West Ward 8 ,, ,, Ward distribution of population 8 Dairies and Cowsheds 75 Day Nursery 55 Death Rate 14 „ ,, Age incidence 15 ,, Outside deaths 18 ,, ,, Ward distribution 17 Diarrhooal Diseases 65 Diphtheria 27 Enteric Fever 81 Factories and Workshops 81 & 88 Home Office Table 88 Housing 76 House to House Inspection 79 Infant Consultations 60 Infantile Mortality 45 „ * 1907—1910 49 & 57 1911—1913 57 ,, ,, Employment of married women in relation to 50 Inquests 73 Inhabited house duty—exemption 76 Isolation Hospital 81 Laboratory—Council 75 Local Goverment Board Tables 83-88 Measles 36 Mortality between 1 and 5 years of age 69 Mortuary—Public 74 Notification of Births Act, 1907 72 Notification of Infectious Diseases 19 Acton, 1913 19 1890—1913 22 ,, ,, ,, County of Middlesex 20 Outworkers 89 Population 6 Sanitary Improvements—Table of 91 Scarlet Fever 29 Sewage Disposal 76 Slaughter Houses 75 Tuberculosis 37 ,, Deaths 37 ,, Notification 37 ,, Occupation of sufferers 37 & 43 Unsound Food 75 Whooping Cough 37 Zymotic death-rate 19 3",Acton,"married,women",bigram search,b19783474,Acton.1913.b19783474.txt,1913
"Mortality, and I do not think it is possible to improve upon the concise summary which the Medical Officer gives in that part of the Report which deals with the Special Conditions associated with high Infant Mortality. 1. The relative importance of the many factors concerned in causing excessive infant and child mortality is difficult to assess; these factors are not identical for all districts. In this part of the present report special stress has been laid upon the factors of defective sanitation and housing, the removal of which is within the control of Sanitary 2. The industrial employment of married women must necessarily involve some neglect of the home, and especially of any young children. 28 3. Conservancy systems of disposal of excreta are very commonly associated with excessive infant mortality. 4. The smallest incidence of disease, especially of diarrhœal diseases, occurs usually in districts supplied with water-closets. 5. In the history of several towns the conversion of a conservancy into a water-carriage system has been associated with a great reduction of mortality from diarrhceal diseases; whilst in other towns the continuance of conservancy systems has been associated with continued high diarrhceal mortality. 6. Unpaved yards and streets and",Finchley,"married,women",bigram search,b19790156,Finchley.1913.b19790156.txt,1913
"Norland 609 29 Pembridge 284 15 Holland 250 12 Earl's Court 211 12 Queen's Gate 104 7 Redcliffe 237 12 Brompton 122 10 The Borough 3,335 19 The effects of social status on the birth-rate are illustrated by the fact that the rate for South Kensington is less than half the rate for North Kensington, whilst the birth-rate for Golborne Ward in the North is more than four times as great as the rate for the Ward of Queen's Gate in the South. To a certain extent this wide discrepancy is no doubt due to differences in the numbers of married women of child-bearing age in the districts compared. 5 The births occurring every year in Kensington have fallen in round numbers from 4,500 in 1880, to 3,300 in the present year The steady decline in the birth-rate is shown in Table V. Appendix, p. 75, where the number of births and the birth-rates both for London and Kensington are given for cach quinquennial period since 1881. The figures for each year were given in the Annual Report for 1908. The fact that the total number of births has risen by , from 3,190 in 1910 to 3,335 in the",KensingtonMetropolitanBorough,"married,women",bigram search,b18235694,KensingtonMetropolitanBorough.1913.b18235694.txt,1913
"was exceeded only by the rates for the whole County (24.71) and for Willesden (24.01). The . In the case of St. Marylebone the corrected total has always been used on account of the great excess of non.resident births taking place in Queen Charlotte.s Lying.in Hospital registered in the Borough. 19 BIRTHS. rate observed in Westminster (12.63) was the lowest of the series, that for Hampstead (14.34) the next lowest, being nearly 2 per 1,000 higher. Doubtless the great differences to be seen in the rates included in Table 16 are, in part at least, due to different proportions of married women at fertile ages. In the next report it is hoped that it may be possible to include standard rates for all the districts, and thus make the corrections rendered necessary by such differences in the populations. TABLE 15. Births Recorded. Birth.rates. Percentage of Illegitimate to Total Births, 1913. Total. Illegitimate. 1913. 1912. 1908.12. Males. Females Males. Females. Boroug 1,540 1,479 101 87 1957 19.48 20.30 6.22 Wards. Queen.s Park 176 179 6 5 22.03 24.98 24.89 3.09 Harrow Road 376 376 13 12 27.50 25.95 27.48 3.32 Maida Vale 222 200 15 20 1945 20.69 19.93 8.29 Westbourne",PaddingtonMetropolitanBorough,"married,women",bigram search,b18245274,PaddingtonMetropolitanBorough.1913.b18245274.txt,1913
"oost of the Woolwich shelter is about £9, and the cost of the Street shelter £4. These shelters are lent at a small rent varying from 1s. 6d. to 3d. per week, according to means. Only those who have no source of income are now exempted from payment. The weekly call to collect the rent insures that the shelter is being used. Shelters were lent to 22 persons last year, 17 men, 4 women, and 1 boy. 4 of these had the shelter free, 1 paid 3d., 15 paid 6d., and 2, 1s. a week. Two have been occupied by married women for nearly three years. Most of the patients using shelters are now under the supervision of the Tuberculosis Dispensary. 71 The results have been eminently satisfactory. In many cases the shelters have been of the greatest value in enabling an advanced and infectious case to be isolated from other members of the family; without the shelter the patient would have had to occupy the same bedroom, if not the same bed, as other persons. Three bedsteads with bedding are also being lent to needy cases too poor to provide such. 84a. Tuberculosis Dispensary. A Dispensary for the treatment",Woolwich,"married,women",bigram search,b19823381,Woolwich.1913.b19823381.txt,1913
"Mall 10 Victoria 723 Great Marlborough 71 St. Margaret 93 Charing Cross 25 St. John 623 Covent Garden 87 Knightsbridge Hamlet 73 Strand 5 The birth-rate, uncorrected, was 12'6, corrected 14'2 per 1,000 persons. The corrected birth-rate for the five years 1903—7 was 17'2, and for the five years 1908—12, 15-4 per 1,000. The birth-rate for the County of London for 1913 was 24-5, the rate during the preceding ten years averaged 25'8 per 1,000. The birth-rate in England and Wales was 23'9 ; the average of the preceding ten years was 27'1. The birth-rate calculated on the number of married women in Westminster, distinguishing the legitimate and illegitimate, shows more exact rates:— Westminster. 1906. 1907. 1908. 1909. 1910. 1911. 1912. 1913. Legitimate Births (net) 2,744 2,764 2,739 2,548 2,399 2,195 2,194 2,057 16.1 16.4 16.4 15.5 14.7 13.7 13.8 13.0 Illegitimate Births (net) 187 163 174 203 193 166 155 176 0.47 0.42 0.45 0.53 0.51 0.44 0.42 0.48 7 During the year notification was received of 1,462 births which took place in Westminster; of these, 38 were stillborn children, whose births are not subsequently registered; (12 other stillbirths were known but not notified). By comparing the births which",CityofWestminster,"married,women",bigram search,b18247787,CityofWestminster.1913.b18247787.txt,1913
"to the homes of patients. It should be stated that some of those visits related to cases notified in previous years. Women and children patients are visited by the female inspectorial staff, and during the year 1634 visits and revisits were paid to the homes of these patients. The number of women known to be suffering from Tuberculosis (all forms) at the end of 1913, was 323, classified as follows :— Tuberculosis of the lungs (Phthisis) 303 Tuberculosis of the glands 2 Tuberculosis of the limb 13 Tuberculosis of the skin 5 Of these 323 women Tuberculosis patients, 162 were married women and 151 unmarried. There were 51 deaths of women patients during the year (35 married, 14 single). Forty-nine of these deaths were due to Phthisis. It is evident from the result of the statistics so far rendered available owing to the compulsory notification of Tuberculosis that there is a very widespread distribution of the disease amongst children. Thus in Battersea the number of children known to be suffering from the disease (all forms) is 319, classified as follows :— Tuberculosis of the lungs (Phthisis) 215 Tuberculosis of the spine 12 Tuberculosis of the limb 39 Tuberculosis of the",Battersea,"married,women",bigram search,b18111208,Battersea.1913.b18111208.txt,1913
"Employments. Although in some cases it has not been easy to determine the past or present occupations of some 111 of the 220 Heads of families, they may be roughly classified as follows:— Men 125 in unskilled labour (of whom few are in regular employment. 19 in skilled trades. 21 costers or general dealers. 10 organ grinders or professional beggars. 12 no occupation or unknown. 2 agents for the property. 189 Total As quite a number of these men are from various causes habitually out of work, or do only occasionally wood chopping or costering, there are in consequence 47 married women who either supplement their wages or who are the real wage earners of the family. About half of these women work at laundries and the rest are employed charring, or similar work. There are also 36 widows or deserted wives who support their families in the following ways:— 18 work in laundries or do charing, etc. 2 have small shops. 5 are costers or professional beggars. Thus out of 226 families, 93 are seen to be mainly, if not entirely dependant on the work of the women. Police Records, &c. The records of police convictions have not been",Fulham,"married,women",bigram search,b18110885,Fulham.1913.b18110885.txt,1913
