contextText,location_fromMOH,searchCriteria_bigram,searchCriteria_type,source_bNumber,source_fileName,time_year
"which may need more than four weeks' treatment in the hospital from the date of confinement, the Borough Council to have the right to give three days' notice at any time from the 25th day of treatment that it will no longer be responsible for the cost of maintenance of such patients, and, after the expiration of such notice, the patient to be regarded as one for whom the County Council and not the Borough Council is responsible. (D) The rate of payment of 9s. 0d. a day for each occupied bed to be continued. These beds are available for married women only. During the year 59 patients were admitted to this Ward. Of the 59 cases admitted in 1932, 27 were assessed to pay £1 l1s. 6d. weekly; 18 were assessed to pay £2 2s. 0d. weekly; 1 was assessed to pay £2 10s. 0d. weekly; 10 were assessed to pay £2 12s. 6d. weekly; and 3 were assessed to pay £3 3s. 0d. weekly. The patients, who are admitted without the intervention of the Relieving Officer, receive treatment from the Medical Superintendent of the Hospital, and contribute towards the cost of their accommodation according to the assessment of",HampsteadMetropolitanBorough,"married,women",bigram search,b18238373,HampsteadMetropolitanBorough.1932.b18238373.txt,1932
"to note that the number of new cases shows a slight decrease whereas the attendances at the Dispensary show an increase. Altogether 627 examinations were made in the 12 months and 204 specimens of sputum were tested. In all 232 progress reports have been forwarded to the London County Council on those patients who have been at a sanatorium either for pulmonary or surgical tuberculosis. Out of these one finds that 107 are working, 106 at their original occupation and one at a new occupation; 8 are unable to obtain work, 9 are doing light house work—these are mostly the married women —18 have transferred to other districts, 3 have been crossed off the register as "" recovered,"" 3 have died and 31 are unfit for work. Some 52 failed to attend for examination for some reason or other, as lost sight of or refusal to attend, but 29 were reported as being well and working. The Care Committee has met fortnightly during the year and 361 patients have been brought to their notice, either because they were going to sanatorium or had returned from treatment, or were recommended to the Charity Organization for assistance in connection with work or",StMaryleboneMetropolitanBorough,"married,women",bigram search,b18254445,StMaryleboneMetropolitanBorough.1932.b18254445.txt,1932
"a consulting room and a treatment room with three oubicles. In addition, the general waiting room of the Foot Clinic on the ground floor was used for a similar purpose, the sessions being held, of course, at different times. Mrs. Ivens-Knowles, C.B.E., M.S., Ch.M., F.C.O.G. (who is also on your Council's panel of Obstetric and Puerperal Consultants) took clinical charge, and a monthly session has been held during 1932. Patients are seen for the following conditions:— (a) Ante and Poet-Natal consultations. (b) Consultant advice and treatment for women suffering from gynaecological conditions. (c) Provision of advice on contraceptive methods for married women who attend the Clinic for such medical advice or treatment and in whose cases) pregnancy would be detrimental to health. 34 The attendances during 1932 may be summarised thus:— New. Old. Total. Ante-Natal Cases 7 4 11 Gynaecological Cases 59 105 164 Contraceptive Cases 14 26 40 Total 80 135 215 The expenditure for the calendar year was as follows:— £ s. d. Salaries—Consultant, Nurse, Clerk, Caretaker 84 15 6 Drugs and Appliances 6 3 6 Rates 1 17 1 Heat, Light and Water 2 17 6 Miscellaneous 1 0 6 Total 96 14 1 Receipts 5 11",Walthamstow,"married,women",bigram search,b19876373,Walthamstow.1932.b19876373.txt,1932
"Female. Male. Female. Single 534 574 524 517 Married 426 312 438 384 Widowed or divorced 40 110 38 99 These tables give a good indication of certain of the special features of the population of the City. It is essentially an older population, the average age being 35.5 years for males and 36.9 for females, as compared with the averages for the whole County of 32.0 and 33.9 The preponderance of females over males is above the average for the County, and the proportion of single persons, especially females, is high. The last facts, and the greater number of married women who are over childbearing age in an older population, account largely for a low birth-rate. The relatively very low proportion of children in the population is due to this low birth-rate, and to the fact that the larger families are particularly apt to move away from Central London. The City offiers much employment to single persons in resident posts as hotel, club or domestic servants, and to married couples without children as caretakers. 17.2 per cent, of the population recorded in the Census were resident in hotels, boarding houses and lodging houses, as compared with 3.6 over the",CityofWestminster,"married,women",bigram search,b18247945,CityofWestminster.1932.b18247945.txt,1932
"in London only 1,044 females who are marriageable (single, widowed or divorced) to every 1,000 marriageable males of the same age. In Kensington, the number of marriageable females between the ages of 20 and 29 to each 1,000 marriageable males of the same age is 1,743. 5 MARRIAGES. During the year, 1,783 marriages were registered, representing a rate of 195 per 1,000 of the population. The place of marriage is set out in the following table:— Church of England 654 Roman Catholic Church 228 Nonconformist Church 26 Jewish Church 9 Register Office 866 Total 1,783 MARITAL CONDITION. The number of married women under 45 years of age per 1,000 females of all ages in Kensington is 176. This figure is slightly lower in Chelsea, St. Marylebone and Westminster, but all other metro politan boroughs show a higher figure. Thus, Kensington has a heavy preponderance of unmarried females. Indeed, between the ages of 15 and 44, there are in Kensington 35,552 single, widowed or divorced women out of a total of 56,859 females between these ages, whereas in London as a whole the number of single, widowed or divorced women between the ages of 15 and 44 is 645,084 out of",KensingtonMetropolitanBorough,"married,women",bigram search,b18235797,KensingtonMetropolitanBorough.1932.b18235797.txt,1932
"... Malformations, etc. 15 12 27 Senility 8 9 17 Suicide 5 4 9 Other Violence 15 7 22 Other defined Diseases 22 16 38 Causes ill-defined or unknown ... ... ... Total 240 248 488 Special Causes:— Small Pox ... ... ... Poliomyelitis ... ... ... Polio-encephalitis ... ... ... SOCIAL CONDITIONS. The following table taken from the Surrey County Volume, Part 1, of the Census, 1931, will give some idea of the local age and condition distribution of the population in this district. Areas. Average age. Age distribution per 1,000 of each sex (ages last birthday). Number of married women aged less than 45, per 1,000 females of all ages. Number of females per 1,000 males. Males. Females. M. F. 0-4 yrs. 5-19 yrs. 20-39 yrs. over 40 yrs. 0-4 yrs. 5-19 yrs 20-39 yrs. over 40 yrs. Surrey 32.7 35 74 240 327 359 61 208 334 397 Mitcham 29.5 30.8 91 253 373 283 88 236 373 303 Areas. Marital condition distribution per 1,000 of each sex. Males. Females. Single. Married. Widowed and divorced. Single. Married. Widowed and divorced. Surrey 495 473 32 504 412 44 231 1,171 Mitcham 494 481 25 467 465 68 313",Mitcham,"married,women",bigram search,b19882026,Mitcham.1932.b19882026.txt,1932
"13 Multiparæ 92 Not pregnant 10 115 Periods of Gestation:— In 1st month 1 „ 2nd „ 11 „ 3rd „ 14 „ 4th „ 20 „ 5th „ 16 „ 6th „ 16 „ 7th „ 19 „ 8th 8 „ 9th „ Nil. Full term confinements 68 Not yet confined 33 Removed from district 4 Premature birth 3 Miscarriage 1 Stillbirths Nil. Known confinements:— At home 51 ,, institutions 21 — 72 47 Cases brought forward 1931:— Full term confinements 15 Premature birth 1 Not pregnant 1 – 17 MOTHERS' CLINIC. A clinic to provide contraceptive advice for married women within the terms of the Memorandum of the Ministry of Health was opened at Cornwall Road in October. The clinic is to be held in two consecutive weeks every two months, on Thursday afternoons. At this time there is no Maternity or Child Welfare session held at the centre. Mothers may be recommended by doctors at the clinics or from hospitals in the neighbourhood. Two members of the Health Visiting staff received a course of training in the management of such a clinic at Burdett Road. Our thanks are due to the Secretary and the Medical Officer at",BethnalGreenMetropolitanBorough,"married,women",bigram search,b18236637,BethnalGreenMetropolitanBorough.1932.b18236637.txt,1932
"had to be made before the children could be traced. In another case the almoner of a hospital drew attention to a child in the care of an aged relative. The Health Visitor found, however, that the child was well cared for and the aged relative agreed to bring the child to the Council's Centre from time to time. A number of visits have also been made in connection with the adoption of foster children through the organisation of an Adoption Society whose offices are in the Borough. Birth Control. Arrangements were made for contraceptive advice to be available for married women attending the Council's Centres in cases where further pregnancy would be injurious to health. The advice is to be given only where recommended by the Medical Officers of the Centres and approved by the Medical Officer of Health. The facilities offered by a voluntary birth control clinic are to be utilised and a small fee per case (5s.) will be paid by the Council. Health and Baby Week. Health Week, with which Baby Week was combined, was observed in the Borough during the week 8th to 14th October, 1933. With a view to economy the programme was limited",HolbornMetropolitanBorough,"married,women",bigram search,b18238762,HolbornMetropolitanBorough.1933.b18238762.txt,1933
"Health Centre 13, Mattock Lane, Ealing Ealing Town Council Health Centre Cherington House, Han well Ealing Town Council Health Centre Ravenor Park, Greenford Ealing Town Council Health Centre Islips Manor, Northolt Ealing Town Council Orthopaedic Clinic 13, Mattock Lane, Ealing Ealing Town Council Special Clinic 13, Mattock Lane, Ealing Ealing Town Council Tuberculosis Dispensary Green Man Passage, West Ealing Middlesex County Council Treatment Centres for Certain Hospitals Middlesex County Venereal Disease in London Council Special Clinic.—Early in the year the Council decided to provide a Special Clinic at which advice on birth control could be given to mothers who are married women and who have been regularly attending one of the Health Centres. Cases are only referred to this Clinic by the Council's Medical Officers and no case is referred unless the Medical Officer is of opinion that further pregnancy would be detrimental to the woman's health. Arrangements have been made for a medical woman experienced in this work to attend at one of the Health Centres on one afternoon in each month and for a Health Visitor, who has been specially instructed in the work, to be in attendance on one afternoon in each week. The first session was",Ealing,"married,women",bigram search,b19787935,Ealing.1933.b19787935.txt,1933
"— 0•1 Other Deformities f — — 0•9 1 0•5 0•7 o — — 0•2 — — 0•2 Other Defects f — — 2•5 4 1•9 2•6 o — — 1•4 — — 1•5 43 Maternity Beds. (I) New End Hospital. The Borough Council has made an arrangement with the London County Council whereby a ward containing five beds is set aside for Borough Council cases. The Borough Council contribute 9s. per day per bed occupied, and the patients are assessed by the Assistance Sub-Committee of the Borough Council to contribute according to their means. These beds are available for married women only. During the year, 46 patients were admitted to this ward. (II) Queen Charlotte's Hospital. The Borough Council subscribes £1 in respect of every Hampstead mother confined in this Hospital and receives Hospital Letters of Admission in return. During 1933, the number of Hampstead women for whom such contribution was made was 59. (III) Queen Mary's Maternity Home, Heath Street. This Home is available for the wives of ex-service men. The Borough Council does not make a grant to the Home. During 1933, 45 Hampstead mothers were confined there. The Children's Hospital, College Crescent. The Borough Council has",HampsteadMetropolitanBorough,"married,women",bigram search,b18238385,HampsteadMetropolitanBorough.1933.b18238385.txt,1933
"100 ,, ,, with complementary feed 78 Weaned 87 Reasons for weaning in 87 cases :— Mother refused to breast feed 36 Breast milk failed 33 Mother at work 6 pregnant 1 Twins 3 Illness of mother 4 baby 4 Failure of breast milk was due to :— Worry of mother 12 Debility of mother 7 Home conditions 7 Badly managed infant 5 Illness of baby 2 Babies died Found dead in cot 2 Whooping Cough 1 Pneumonia 1 Marasmus 1 Gastro-Enteritis 2 48 MOTHERS' CLINIC, 1933. This Clinic, which was established in October, 1931, to give Contraceptive advice to married women within the terms of the Memorandum issued by the Ministry of Health, has been held on two consecutive Thursdays in alternate months. Every effort has been made to keep this Clinic distinct from the other work of the Centre, all stores and apparatus and all records being kept separately ; also at the time at which it is held there is no other clinic on the ground floor. On their first attendance each Mother receives a complete physical examination, and gynaecological examination, and in suitable cases contraceptive instruction. Each subsequent week they must demonstrate their ability to practise",BethnalGreenMetropolitanBorough,"married,women",bigram search,b18236649,BethnalGreenMetropolitanBorough.1933.b18236649.txt,1933
"conditions. Renewed acknowledgment must be made of the excellent work of the staff. Women's Clinic.—The staffing and scope of this Clinic were detailed in the Report for 1932, and remained unaltered up to the end of September, when Miss M. Basden, M.D., F.R.C.S., F.C.O.G., was appointed to succeed Mrs. Ivens-Knowles who, unfortunately, resigned for personal reasons. In February, the sessions were increased from one to two per month. Total attendances have been as follows:— New Old Total Ante-Natal Cases 14 9 23 Gynaecological 115 246 361 Contraceptive 11 41 52 Total 140 296 436 Contraceptive advice is only given to married women in whose cases further pregnancy would be detrimental to health. It is hoped that private practitioners will utilise the Clinic particularly for Consultant ante-natal advice for those of their patients requiring it. (vi) Hospitals.— There were no changes during 1933 in the Hospital services used by the inhabitants of the Borough. Public Assistance in Walthamstow is provided by the SouthWest Area Committee of the Essex County Council, which retains a certain proportion of beds in each of the local institutions formerly provided by the West Ham Board of Guardians. Mr. Pegram, the Clerk to the Committee, has kindly",Walthamstow,"married,women",bigram search,b19876397,Walthamstow.1933.b19876397.txt,1933
"15.23 Congenital defects 14.69 14.66 11.26 8.39 7.38 7.65 7.11 6.65 7.58 6.84 All causes 108 103 79 65 64 71 59 65 67 60 The average infant mortality for the four years 1930-33, namely 63 per 1,000 births, is less by about 42 per cent. than that for the period 1911-14. Among the causes of death shown in the table the most remarkable decrease is that from tuberculosis, the mortality in 1930-33 from this cause being less than one-fourth of that in 1911-14. In the following table the birth-rates per 1,000 of population, the fertility-rates (legitimate births per 100 married women aged 15-45 years), the percentage of illegitimate births and the infant mortality rates for the county of London and each metropolitan borough are shown for the three-year periods 1921-23 and 1930-32, the percentage increase or decrease in the rates being also shown. The decrease in the fertility-rates shows some variation in the different boroughs, but having regard to the divergent conditions of life the percentage decrease is generally remarkably constant. To the general marked decrease in the infant mortality there are some exceptions which are difficult to account for. In the case of Paddington the rate has considerably",LondonCountyCouncil,"married,women",bigram search,b18252801,LondonCountyCouncil.1933.b18252801.txt,1933
"Of the three who failed to attend one case was admitted to Hospital for operation for middle ear disease. It is the daily treatment of Aural trouble that is the essential part of its cure, and it is very difficult for the poorer inhabitants of the District to obtain this treatment except through the School Clinic. The scheme has probably resulted in the prevention of chronic discharge from the ear, and possibly deafness. 27 BIRTH CONTROL. Memorandum 153/M.C.W. and Circular 1208, dated 14th July, 1931, of the Ministry of Health, gave permission to Maternity authorities to teach Birth Control to married women attending Maternity and Child Welfare Centres who are either pregnant or nursing mothers, and to whom further pregnancy would be detrimental to health. No advice was given during the year. During the course of the year a request was made at a Meeting of Fathers that I should lecture in the District on Birth Control and Vaccination. This request was conveyed to the Council, and the Council determined that two such Lectures should be given, one in the Eastern portion of the District and one in the Western. Arrangements for these two Lectures are now being made. It",Enfield,"married,women",bigram search,b19789221,Enfield.1933.b19789221.txt,1933
"— 0.0 Other Deformities f — — 1.0 1 03 0.8 o — — 0.3 — — 0.2 Other Defects f 3 0.8 2.7 4 11 2.8 o — — 1.5 2 0.6 1.6 46 Maternity Beds. (I) New End Hospital. The Borough Council has made an arrangement with the London County Council whereby a ward containing five beds is set aside for Borough Council cases. The Borough Council contribute 9s. per day per bed occupied, and the patients are assessed by the Assistance Sub.Committee of the Borough Council to contribute according to their means. These beds are available for married women only. During the year, 36 patients were admitted to this Ward. (II) Queen Charlotte's Hospital. The Borough Council subscribes £1 in respect of every Hampstead mother confined in this Hospital and receives Hospital Letters of Admission in return. During 1934, the number of Hampstead women for whom such contribution was made was 46. (III) Queen Mary's Maternity Home, Heath Street. This Home is available for the wives of ex.service men. The Borough Council does not make a grant to the Home. During 1934, 52 Hampstead mothers were confined there. The Children's Hospital, College Crescent. The Borough Council has",HampsteadMetropolitanBorough,"married,women",bigram search,b18238397,HampsteadMetropolitanBorough.1934.b18238397.txt,1934
"Council from time to time. The question as to whether Clinics of this nature should be provided by Local Authorities is one which has caused a good deal of controversy, not only amongst the Public but amongst religious and other bodies. A Circular, however, issued by the Ministry of Health states that Clinics may be provided on the understanding that the following conditions are strictly complied with:— (1) That the Clinics will be available only for women who are in need of medical advice and treatment for gynaecological conditions. (2) That advice on contraceptive methods will be given only to married women who attend the clinics for such medical advice or treatment, and in whose case pregnancy would be detrimental to health or who are suffering from other forms of sickness, physical or mental, such as those mentioned in the Report of the Departmental Committee on Maternal Mortality and Morbidity. As it appeared from the reports of the Medical Officers in charge of our various Ante-Natal and Welfare Centres that it was desirable that information should be available for married women attending the Centres, the Council made arrangements with the Authorities of the Walworth Women's Welfare Centre who have been",Greenwich,"married,women",bigram search,b1823754x,Greenwich.1934.b1823754x.txt,1934
"Hospital accommodation in East Ham. Birth Control. In a report to the Maternity and Child Welfare Committee dated September, 1934, Circular 1408 of May, 1934, issued by the Minister of Health, subsequent to Memo. 153, March, 1931, was fully dealt with. The Memo, stated that any Departmental sanction which might be necessary to the establishment of such clinics would only be given on the following conditions:— (1) That the clinics will be available only for women who are in need of medical advice and treatment for gynaecological conditions, and (2) that advice on contraceptive methods will be given only to married women who attend the clinics for such medical advice or treatment, and in whose cases pregnancy would be detrimental to health. 117 Circular 1408 referred to clinics already established on these grounds and extended their use to married women suffering from other forms of sickness, physical and mental, such as those mentioned in the Report of the Departmental Committee. The Minister states that what is or is not medically detrimental to health must be decided by the professional judgment of the registered medical practitioner in charge of the clinic. No clinic had previously been formed for the purpose of",EastHam,"married,women",bigram search,b19874613,EastHam.1934.b19874613.txt,1934
"were not in receipt of relief, but were needing extra nourishment, could be assisted by grant of extra nourishment at the expense of the borough council. Help given under this heading is included in the total expenditure of the borough council given above. The council gave consideration to the new scheme of the Milk Marketing Board for supplying milk to schoolchildren at reduced prices, and sent a recommendation to the board asking them to consider extending the scheme so as to cover pre-school children attending maternity and child welfare centres. Birth Control. The question of giving birth control advice to married women has occupied the council's attention on various occasions. In 1931, they decided to pay a fee of five shillings in respect of each married woman referred for birth control advice by a Kensington infant welfare centre to the North Kensington Women's Welfare Centre (birth control clinic). The conditions upon which advice could be given were strictly medical, social and economic grounds not being accepted. 36 In July, 1934, the council asked the Minister of Health to receive a deputation on the subject of the relaxation of the conditions laid down in the Minister's memorandum 153/M.C.W. The deputation attended",KensingtonMetropolitanBorough,"married,women",bigram search,b18235815,KensingtonMetropolitanBorough.1934.b18235815.txt,1934
"than five days after delivery, would be transferred to the heading of sepsis. It is, therefore, necessary to bear in mind the probability that there is some interchange between the heading of sepsis and other causes of death respectively. The figures relating to deaths from abortion, of which the majority are due to sepsis, are given for single and married women, separately, for England and Wales as a whole since 1927 in the text volumes of the annual reports of the Registrar. General. In the following table the percentage of septic abortions to total deaths from sepsis among single and married women respectively are added:— Abortion. England and Wales.—Deaths from septic abortion. Year. Single women. Married women. Total deaths from sepsis. Deaths from septic abortion. Total deaths from sepsis. Deaths from septic abortion. No. Per cent. No. Per cent. 1928 72 20 28 1,099 198 18 1929 77 27 35 1,072 205 19 1930 79 26 33 1,152 271 24 1931 76 34 45 960 189 20 1932 76 38 50 908 219 24 The increase in the proportion of septic abortions, especially among single women, is independent of the movement of the total sepsis rate, which indeed was lower",LondonCountyCouncil,"married,women",bigram search,b18252813,LondonCountyCouncil.1934.b18252813.txt,1934
"received. In some cases it has been possible to effect satisfactory arrangements for the purpose through the co-operation of the Child Guidance Council. Deaths of Children 5 to 15 years. There were six deaths in this age group during 1934, three males and three females. The deaths were from the causes shown below: — Diphtheria F. (5 years) Ditto M. (6 years) Violence (Knocked down by motor van) M. (6 years) Tuberculous meningitis M. (12 years) Broncho-pneumonia F. (14 years) Status epilepticus, nodular sclerosis F. (5 years) 87 Birth Control. Arrangements were made for contraceptive advice to be available for married women attending the Council's Centres in cases where further pregnancy would be injurious to health. The advice is to be given only where recommended by the Medical Officers of the Centres and approved by the Medical Officer of Health. The facilities offered by a voluntary birth control clinic are to be utilised and a small fee per case (5s.) will be paid by the Council. No case was referred for such advice in 1984. Health and Baby Week. Health Week, with which Baby Week was combined, was observed in the Borough during the week 7th to 13th October, 1934.",HolbornMetropolitanBorough,"married,women",bigram search,b18238774,HolbornMetropolitanBorough.1934.b18238774.txt,1934
