contextText,location_fromMOH,searchCriteria_bigram,searchCriteria_type,source_bNumber,source_fileName,time_year
"chest (excluding phthisis), the result of exposure, and from miasmatic diseases, probably derived from their residences. They exhibit a high proportion of fatal liver disease. The high proportion of heart disease is probably the result, through rheumatism or bronchitis, of exposure to cold and we.t. 16. Schoolmasters.—Only a small proportion of these died, the expectation of life, from our limited experience, being 34 years. b. FEMALES. The rate of mortality of females following industrial occupations cannot be estimated, nor yet, fairly, the average age at death, in consequence of the imperfection of the mortuary returns, which in the instance of married women do not in all cases specify the occupation followed. The particulars as to the cause of death, as given in Table XIV., are open to fewer crbjections on this score. Dressmakers and Milliners appear to die to a large extent from consumption, 42 per cent, of the deaths being attributable to this cause. There is no difficulty in associating this with the damage inflicted upon the health from excessive and late hours of work in close, crowded, and confined rooms, together with deficient bodily exercise. The large proportion of young persons following these occupations, who at a later",IslingtonMetropolitanBorough,"married,women",bigram search,b18248640,IslingtonMetropolitanBorough.1864.b18248640.txt,1864
"class, are now becoming absolutely essential to preserve healthy vitality, and save the risk which threatens large numbers of persons from a gradual degeneration. Abundant proof of this can be found in the more thickly populated parts of this wealthy Parish. A few hundred pounds would be amply repaid in health and in having the satisfaction of some benefit for rates, while the diminution of pauperism would soon be manifest. 25 Female Labour. Female labour is on a very unsatisfactory footing— young women living at home with their parents, certainly earn wages which contribute partly to their maintenance ; some married women work far below the fair value of labour to supplement the wages of a husband whose work is casual and uncertain, often from drunkenness ; female labour even attempts to compete with manufacturing establishments ; some married women again, who erroneously desire to utilize their spare time in working for shops, neglect domestic duties, and thus lower the price of female labour of single women. The worst cases, however, are those of the solitary sempstress, prolonging her hours of work in a small close room, or working by candle light, far into the night, bringing about some debilitating",Paddington,"married,women",bigram search,b19955212,Paddington.1870.b19955212.txt,1870
"as against an average of 720 during a similar period. Very many thousand circulars addressed to ""heads of families"" in the richer parts of the parish, led to the re-vaccination of large numbers of domestic servants. It is said, however, that ""mechanics and the labouring classes are apparently careless ""about re-vaccination, • even when small-pox has broken out in the house."" To facilitate 90 re-vaccination the Guardians opened a temporary night station at Cathcart Road, in the south district, and made provision for late attendance at the public station in the north district. Proceedings were taken in two cases against married women for offences under the Births and Deaths Registration Act, viz., false statements given to the Registrar on the occasion of registering a birth, the object of falsifying the Register being to evade the vaccination of children. In the first case the woman was convicted, but the judge, whose opinions on the vaccination question are pronounced, imposed the nominal punishment of two days imprisonment, the offender being at once discharged. In the other case the offender pleaded guilty, and having been severely censured by the judge, was liberated on her entering into recognizances to come up for judgment when",Kensington,"married,women",bigram search,b19824221,Kensington.1880.b19824221.txt,1880
"2 11 1 14 Suicidal Causes. Haemorrhage from cut throat with razor 2 ... ... 2 Hanging ... ... 1 1 Poison cyanide of potassium, 1 ... ... 2 2 prussic acid 1 Wilful Causes. Strangulation ... ... 1 1 Haemorrhage from cord by neglect of mother ... 1 1 2 Suffocation 1 ... ... 1 Ditto (from fire) ... 2 ... 2 Total 15 56 17 88 c 2 36 The British Lying-in Hospital, Endell Street. The following statistics refer to this hospital, which continues under its able management to render valuable assistance to a number of deserving poor married women during their confinement. During the year 142 women were delivered of 139 children born alive and 3 still-born; of the living children 67 were males, and 72 females. Only 17 of the mothers were parishioners, viz., 5 of St. George, Bloomsbury; 6 of St. Giles, South; and 6 of St. Giles, North. The remaining 122 resided in various metropolitan parishes before they came into the hospital for their confinement. There were 5 deaths (non-parishioners) in the hospital, viz., 3 mothers and 2 children; of the mothers, one died, aged 39, from placenta prsevia; another, aged 27, from pneumonia;",StGilesCamden,"married,women",bigram search,b19875757,StGilesCamden.1880.b19875757.txt,1880
"of Hackney since 1841, and shews indirectly the great increase of our population by the augmented number of our births and deaths. During the 10 years, 1841-50, the mean annual number of births was 1,398, and of deaths 946; in 1861-70, the mean annual number of births was 3,440, and of deaths, 2,182; and in 1882 there were 6,423 births to 3,505 deaths registered 16 in the district. The birth rate as compared with the death rate has, with a few exceptions, kept continually increasing sinoe 1841, shewing that, as oompared with the rest of the population, the number of married women at child-bearing ages has increased very considerably since that year. In 1841-50 there were 148 births to 100 deaths; in 1851-60, there were 159 births to each 100 deaths; in 1861-70, there were 157 births to 100 deaths; in 1871-80, there were 178 births to the same number of deaths; and in 1882 as many as 183 births to 100 deaths. The death rate per 1000 population has remained nearly the same during the whole of this period, so that the increased ratio of births to deaths has not been caused to any marked extent by variations in",Hackney,"married,women",bigram search,b19885350,Hackney.1882.b19885350.txt,1882
"counsel, in reply, only remarked that that case was not then in question, and it was not heard of again. The history of this sad affair was very fully set out in several of my monthly reports, and in a special report, (No. 6, May 21, page 45), I gave a summary of the proceedings at the Police Court, &c. The only satisfactory result of the proceedings, was, that the midwife, conscious of her wrong doing, and fearing that further action might be taken ; having, moreover, lost her business, owing to the strong feeling excited against her among the married women in her usual field of practice, quitted the parish.] Class 2.—Parasitic Diseases. Includes Thrush and other vegetable parasitic diseases; 6 deaths, 4 of them in the Town district, and 5 under 1 year of age, and ""Worms, Hydatids, and other animal parasitic 72 diseases,"" no deaths having been registered from these latter causes. Class 3.—Dietic Diseases Were the causes of 18 deaths, 12 of them in the Town subdistrict. Want of breast milk was the cause of 8 deaths. To Scurvy no death was assigned. Chronic alcoholism and delirium tremens were the registered causes of 8 and 2",Kensington,"married,women",bigram search,b19824257,Kensington.1883.b19824257.txt,1883
"an epitome of the chief vital statistics of Hackney and London since 1841, as far as they are obtainable, and it also shows very plainly the great increase in our population since 1841. Thus, the average number of births in the 10 years, 1841-50, was 1,398, whilst in 1883 it was the largest recorded, viz. : 6,502. The mean number of deaths in 1841-50 was 948, in 1883, 3,545 ; the ratio of births to deaths in 1841-50 was 148, and 183 in 1883. This difference in the ratios of births to deaths arises from the much greater number of married women in Hackney now, and the much smaller proportion of servants at present living in Hackney as compared with the number in 1841-50. The number of births to each 100 deaths was the same as for 1882, and is in excess of the mean for 1871-80, when it was 177. The death-rate per 1000 population from the 7 chief zymotic diseases in 1883 was the smallest I have ever recorded, as it was only 2.24 against an average of 3.40 in 1871-80, 3.78 in 1861-70, and 3.56 in 1851-60. The nearest approach to it occurred in 1879, when the",Hackney,"married,women",bigram search,b19885362,Hackney.1883.b19885362.txt,1883
"of the deaths occurred at home, and 46 in hospitals, the majority of them at the Western Fever Hospital. The quarterly totals were 30, 25, 37, and 19 respectively (against 7, 10, 30, and 42 in 1888). The ages at death were: under five years 73, including 1 under one year, 13 between one and two, 15 between two and three, 22 between three and four, and 22 between four and five; between five and fifteen there were 35 deaths, of which 30 occurred between five and twelve. The remaining deaths were of a school girl aged 17, and two married women aged 37 and 42 respectively. The recorded cases of illness were 245, against 144 in 1888, the case-mortality being 45'3 per cent. in 1889, against 61.8 in 1888, in which year, probably, there was a larger proportion of concealed cases: but epidemic diseases tend to become less fatal 26 as the epidemic, so to speak, grows old. Of the 245 cases, reported in 1889, 201 were in North Kensingon, i.e., north of Uxbridge Road, and 44 in South Kensington, i.e., the remainder of the Parish south of Uxbridge Road, against 129 and 15 in 1888. The 201 cases",Kensington,"married,women",bigram search,b19824312,Kensington.1889.b19824312.txt,1889
"or women) in a dwelling house where the landlord does not reside, who have been in occupation for the period above named. (c) Lodgers (male) who have for the like period occupied lodgings of the clear yearly value, if let unfurnished, of £10 or upwards. (d) All male persons inhabiting a dwelling house or room by virtue of any office, service, or employment provided the house is not occupied by the person under whom such man serves. (e) Male owners of freehold property in the parish, provided they are not also registered as occupiers. With regard to the qualification of married women as electors, it is provided by sec. 43 that ""A woman shall not be disqualified by marriage for being on any local government rogister of electors, or for being an elector of any local authority, provided that a husband and wife shall not both bo qualified in respect of the same property."" Section 44 contains instructions as to the manner in which the register of parochial electors is to bo prepared. A question here 120 arises as to whether the first election, which is to be held in November next, will be conducted on the register of voters",StJamess,"married,women",bigram search,b19956411,StJamess.1893.b19956411.txt,1893
"known as the Domestic Workshop, and the establishment of Cretches would provide for the occasional absence of the mother, should she get a day's washing or charing. Moreover, it would not be impossible to utilize these establishments for educational purposes, and some plain and simple instructions in the feeding of infants might be given to the mothers who bring children to be taken care of. I have made some enquiries amongst the manufacturers in my district and also amongst the women themselves. I find that the employment of child-bearing women is not very prevalent in large Factories and Workshops. The married women mostly work at home at Boxmaking, Tailoring, or Bootwork. Factory Owners tell me that the proportion of married women among their female hands does not exceed five per cent., and some of these are widows. Occasionally their female hands continue their occupation for a time after marriage, but if they become pregnant they leave the Factory six or eight weeks before the expected confinement. Some employers say they will not be bothered with women who have children and decline to allow them to return, as they are apt to be irregular in attendance, and frequently kept at home",BethnalGreen,"married,women",bigram search,b17997598,BethnalGreen.1893.b17997598.txt,1893
"order among registration districts in respect of high birth rate, was working on the basis of a ten years' average which gave the Whitechapel birth rate as 351. If the position of Whitechapel were determined by the figures of the last few years the district would stand higher on the list. The rise in the birth rate may have been influenced by the increase already referred to in the number of persons living in blocks of dwellings, and may again be associated with the increase in foreign immigration. The marriage rate for the year 1893 is 11.8 The percentage of married women under 25 to total population obtained from the census return is, in the Whitechapel district, exceptionally high (2.42) ; St. George-in-the-East alone among registration districts has a greater percentage (2.54). Mr. Booth adopts this as his test of the number of early marriages which he notes "" are very numerous in St. George's East and Whitechapel."" Whitechapel stands first in the list of registration districts in respect of its surplus of unmarried males between 15 and 45 years of age. The death rates per 1,000 living in 1891-2-3 for the Whitechapel district, when corrected for deaths occurring in",LondonCountyCouncil,"married,women",bigram search,b18252436,LondonCountyCouncil.1894.b18252436.txt,1894
"year. 34 of the deaths were those of non-parishioners, admitted for treatment from the surrounding districts. 26 of the patients died from consumption, and other chest complaints, 4 from heart disease, 2 from enteric fever, and 1 from traumatic tetanus (lock-jaw), resulting from varicosed ulcer of the leg. 21 of the deaths occurred at the middle period of life, and 5 at advanced ages. III. The British Lying-in Hospital, Endell Street. This Institution, founded in 1749, and rebuilt in 1849, is the oldest Lying-in Hospital in London. It has been established as a charity for the purpose of assisting poor married women only. The Hospital is the means, through its Training School, of supplying midwives and monthly nurses of a superior class to the community at large. Particulars of fees, &c., can be obtained from the Secretary. The Medical Staff of the Hospital report for the year 1894:— "" In-Patient Department.—""The results of the first three months of the year, i.e., to the end of March, indicated that some radical change of routine treatment was necessary, as * 3 deaths had occurred in 31 cases admitted during the time, and 5 other cases were seriously ill. The Medical Staff met",StGilesCamden,"married,women",bigram search,b19875885,StGilesCamden.1894.b19875885.txt,1894
"from erysipelas. The one from enteric fever was contracted outside the Workhouse. 2 — The French Hospital, Shaftesbury Avenue. There were 32 deaths, 26 were non-parishioners. 24 of the deaths were caused from diseases of the heart and lungs. There was one zymotic death, from enteric fever, and one from accident—""fracture of the ribs."" 24 of the deaths occurred between the ages of 25 and 65 years, and 3 above 65. 3.—The British Lying-in Hospital, Endell Street. This is the oldest lying-in hospital in London; it was founded in 1749, and rebuilt in 1849 for the purpose of assisting poor married women at their delivery. The Medical Report for 1897 states that during the year 187 women were delivered in the wards with one maternal death. The patient was in a dying condition from complication of heart and lung mischief on admission, and her case was hopeless. The total number of children born was 189—of these one died 7 days after birth from debility. 79 In the out-patient department 390 mothers were delivered, 8 children were born dead, and 4 others died within a few days of birth, but there was no maternal death. Deaths in Hospitals, Lunatic Asylums, Workhouse",StGilesCamden,"married,women",bigram search,b19875903,StGilesCamden.1897.b19875903.txt,1897
"beds range from 4d. to 6d. per night, and the privilege of allowing a regular lodger to have a bed on Sunday night free is rarely extended to women. The usual charge for a double is 8d., but in some houses where but few married couples are received, 10d., or even 1s. and 1s. 6d. is charged. There is often only one kitchen for use in houses occupied by both sexes. In houses accommodating singles of both sexes and doubles, and in which two kitchens are provided for separate use, the married men may use the women's kitchen, but the married women do not always use the single men's. In a number of houses separate water-closet accommodation is provided for the two sexes, but it is difficult to say to what extent this separate use is maintained in practice. In several instances, at the instigation of the Council's inspectors, the yard in which the water-closets are Situated has been sub-divided by wooden partitions, so as to make this separation more complete. But while separate water-closets are generally regarded as being desirable, the need for separate washhouses is less recognised; thus, in houses occupied by men and women, both sexes often",LondonCountyCouncil,"married,women",bigram search,b18252461,LondonCountyCouncil.1897.b18252461.txt,1897
"increased which seems to indicate, as far as the parish of Willesden is concerned, that the report of the Registrar-General, of the slow but gradual decline of the marriage and birth-rates in the Kingdom generally, is not occurring here, and also indicates that the general prosperity of the District has been rather more than maintained. (17) BIRTHS. The births registered in the year were 3,142, including 17 which occurred in the Workhouse, giving a rate per 1,000 of 31.5, but that does not apparently represent the actual total, as from information obtained at Queen Charlotte's Lying-in-Hospital, it appears that 28 married women went from Willesden for their confinements, besides 63 single women. ILLEGITIMATE BIRTHS. These occurring and registered in the parish were 63:—boys 33, girls 30, being 2.0 per cent. of the total births. DEATHS. The deaths registered in the District were 1,197 —Males 570, Females 627. This would give an average per 1,000 of 12.06, which is rather more favourable than last year and the year before. There have been many deaths of Willesden people occurring outside the District which have to be added. The number, as nearly as can be ascertained, is 200; of these, 60 occurred at",Willesden,"married,women",bigram search,b19975880,Willesden.1898.b19975880.txt,1898
"Walthamstow General Hospital, and the remainder, 17, to various London Hospitals. Factory and Workshop Act.—The number of premises registered under the Factory and Workshop Act has increased from 216 to 501, in consequence of the obligation cast upon authorities to communicate to each other semi-annually the names and addresses of any ""Outworkers"" residing in their respective districts. The work of inspection of these premises is most complicated by the constant changes in the lists, half of each succeeding list consisting of new names in place of the old ones who have ceased to be employed. Many of the outworkers being married women working at home, anxious to add to the family income, work under fair sanitary conditions, and it is rare to find any cause for complaint. The various matters dealt with have been supplied to, and are dealt with in the report of, the Medical Officer of Health. The special premises periodically visited, besides Factories and Workshops, include:— Slaughterhouses 12 Dairies, Cowsheds and Milk Sellers 99 Fishmongers 39 Offensive Trades 3 Only minor causes of complaint were discovered in any of these, which were readily attended to by occupiers when pointed out. The two premises situate in the Northern",Walthamstow,"married,women",bigram search,b19971011,Walthamstow.1902.b19971011.txt,1902
"the ages of 15 and 45) work out as follows for London and the City of Westminster:— 1881. 1891. 1901. 1902. 1903. City of Westminster 238 210 178 184 172 County of London 283 259 236 233 237 A more exact method of estimating the birth-rate is by calculating it on the number of females living at child-bearing ages, distinguishing married and unmarried, legitimate and illegitimate, The illegitimate births were 186 in 1902 (5.7 of the total births), 150 in 1903 (4.7 of the total births). The legitimate birth-rate calculated on the above lines was equal to 174 per 1,000 married women in 1902, 164 per 1,000 in 1903; the illegitimate rate would equal 4'6 in 1902 and 3'8 in 1903, per 1,000 unmarried women between the ages of 15 and 45. The births are arranged according to the old divisions of the City in Table III., and the comparative rates are shown in Table IV. These are, uncorrected for births outside the City. Deaths. 2,517 deaths were registered in the City in the 52 weeks ending the 2nd January, 1904. After deducting 931 deaths of non-citizens in public institutions in the City, and adding those of 833 citizens who",CityofWestminster,"married,women",bigram search,b18247684,CityofWestminster.1903.b18247684.txt,1903
"been prepared. * Farr in Registrar-General's Fourth Annual Report, p. 138. 20 1903] Table VI. Showing the proportion of Married Women at four periods of their child-bearings ages, in every 1,000 of such Married Women. Age Periods. Census Years. Increase or Decrease. 1891. 1901. 15—20 8.14 6.36 — 1.78 20—35 133.05 124.69 — 8.36 25-35 468.94 481.99 + 13.05 35—45 389.87 386.96 — 2.91 1,000 1,000 — Here it is seen that at the two earlier age periods there was a decrease in 1901 in the proportion of married women, for whereas in 1891 there were 8.14 in every 1,000 married women at the 15.20 period, there were only 6.36 per 1,000 in 1901, a decrease of 1.78; and again, in 1891 there were 133.05 in every 1,000 married women at the 20.25 period, there were only 124.69 in 1901, a decrease of 8.36. When, however, we come to the next age period, 25.35,* there were 468.94 per 1,000 married women in 1891, whereas in 1901 there were 481.99 per 1,000, or the very substantial increase of 13.05. This increase is very remarkable, particularly as it occurs at a period of life when the procreative powers are still very active.",Islington,"married,women",bigram search,b18038190,Islington.1903.b18038190.txt,1903
"the same basis. The Registrar-General, in his 66th Annual Report, has shown that on this more reliable method the birth-rate of England and Wales is a rapidly declining one. Table showing the Proportion of Total Births per 1,000 Women aged 15-45. Three-Year Periods. Year. 1870-2 1880-2 1890-2 1900-2 1903. 153.7 147.7 129.7 114.8 113.8 B 18 Births are a prime factor in the national well-being, and this rapid decline in our national birth-rate cannot be viewed without concern. A large part of the decline is undoubtedly due, however, to the later age at which women marry. The proportion of childbearing married women between 15 and 25 to those between 25 and 45 must now be very much less than it was 30 years ago, and on this account the decline in the birth-rate, thus estimated, is less serious than it appears. ILLEGITIMATE BIRTHS. The illegitimate births, which last year had risen from 12 per 1,000 births in 1902 to 21 per 1,000, show a still further increase this year, namely, to 24 per 1,000. This is rather a sad index of the changing character of Willesden, for although the rate is well below that of England and Wales, it is",Willesden,"married,women",bigram search,b19796602,Willesden.1904.b19796602.txt,1904
"(the lowest). TABLE 5. (Census, 1901.) Of 1,000 Females aged 15-45 Proportion occupied per 1,000. Unmarried. Married. Females 15-45. Married and Widowed, 15 years and upwards. Borough 621 354 534 165 London 524 448 466 172 Kensington 688 284 602 234 Westminster 648 320 629 267 Marylebone 634 334 601 250 Hampstead 708 561 128 Willesden 465 513 377 115 Note.—The Condensed Tables of Occupations do not distinguish the ages of ""married and widowed"" engaged in occupations. No female under 15 years of age was returned as married at the last Census. The birth-rate ought to be calculated on the married women of child-bearing ages, due correction being made for the births of illegitimate children. Unfortunatelv the whole of the data necessary for such correction are not available. In Table 6 rates are given based on all births, and also on legitimate and illegitimate, as far as can be done. The table at present gives but little information ; but continued for a series of years, will afford a clear indication of the changes in the fruitfulness of marriage and the improvement (or deterioration) in the morality of the various districts. The only point to which attention need be called",PaddingtonMetropolitanBorough,"married,women",bigram search,b18245195,PaddingtonMetropolitanBorough.1904.b18245195.txt,1904
